{
  "authority": "nxb-v11-compatibility-independent-v1",
  "schema_version": 1,
  "status": "passed",
  "repository": "Naveax/nxb-integrity-research-lab",
  "workflow_id": 1001,
  "workflow_blob_sha": "1111111111111111111111111111111111111111",
  "harness_manifest_sha256": "2222222222222222222222222222222222222222222222222222222222222222",
  "dispatcher_sha": "aaaaaaaaaaaaaaaaaaaaaaaaaaaaaaaaaaaaaaaa",
  "dispatcher_tree_sha": "bbbbbbbbbbbbbbbbbbbbbbbbbbbbbbbbbbbbbbbb",
  "candidate_sha": "aaaaaaaaaaaaaaaaaaaaaaaaaaaaaaaaaaaaaaaa",
  "candidate_tree_sha": "bbbbbbbbbbbbbbbbbbbbbbbbbbbbbbbbbbbbbbbb",
  "base_sha": "9203ab9f89ff4383832119683eb4e19df5490213",
  "base_tree_sha": "241d3086e9bcb5a847445258cab25bff4fd34da8",
  "predecessor_main_sha": "9203ab9f89ff4383832119683eb4e19df5490213",
  "predecessor_tree_sha": "241d3086e9bcb5a847445258cab25bff4fd34da8",
  "cell_id": "win11-25h2-x64-ps76-py312-adk26100",
  "support_class": "primary",
  "axis": "baseline",
  "intent_sha256": "3333333333333333333333333333333333333333333333333333333333333333",
  "policy_sha256": "4444444444444444444444444444444444444444444444444444444444444444",
  "fingerprint_sha256": "5555555555555555555555555555555555555555555555555555555555555555",
  "environment_fingerprint_sha256": "6666666666666666666666666666666666666666666666666666666666666666",
  "compatibility_plan_sha256": "7777777777777777777777777777777777777777777777777777777777777777",
  "endurance_summary_sha256": "8888888888888888888888888888888888888888888888888888888888888888",
  "known_error_scan_sha256": "9999999999999999999999999999999999999999999999999999999999999999",
  "predecessor_replay_artifact_id": 2001,
  "predecessor_replay_sha256": "aaaaaaaaaaaaaaaaaaaaaaaaaaaaaaaaaaaaaaaaaaaaaaaaaaaaaaaaaaaaaaaa",
  "predecessor_replay_receipt_sha256": "bbbbbbbbbbbbbbbbbbbbbbbbbbbbbbbbbbbbbbbbbbbbbbbbbbbbbbbbbbbbbbbb",
  "run_id": 3001,
  "run_attempt": 1,
  "event": "workflow_dispatch",
  "job_id": 4001,
  "job_name": "nxb-v11 / physical-compatibility",
  "selector_provenance": {
    "compatibility_policy_sha256": "4444444444444444444444444444444444444444444444444444444444444444",
    "validation_toolchain_lock_sha256": "cccccccccccccccccccccccccccccccccccccccccccccccccccccccccccccccc",
    "powershell_runtime_admission_receipt_sha256": "dddddddddddddddddddddddddddddddddddddddddddddddddddddddddddddddd",
    "trusted_preparation_receipt_sha256": "eeeeeeeeeeeeeeeeeeeeeeeeeeeeeeeeeeeeeeeeeeeeeeeeeeeeeeeeeeeeeeee",
    "powershell_module_lock_sha256": "ffffffffffffffffffffffffffffffffffffffffffffffffffffffffffffffff",
    "selected_host_python_dependency_lock_path": "validation/v11/locks/validator-py312.lock",
    "selected_host_python_dependency_lock_sha256": "1111111111111111111111111111111111111111111111111111111111111111",
    "adk_wpt_preparation_receipt_sha256": "2222222222222222222222222222222222222222222222222222222222222222"
  },
  "requirements_total": 64,
  "requirements_passed": 64,
  "requirements_all_passed": true,
  "negative_controls_total": 47,
  "negative_controls_passed": 47,
  "negative_controls_all_passed": true,
  "production_boundary": {
    "private_key_used": false,
    "tag_mutation": false,
    "release_mutation": false,
    "merge_mutation": false,
    "repository_protection_mutated": false
  },
  "receipt_hash_not_yet_available": true,
  "outer_zip_hash_not_yet_available": true,
  "admitted": false,
  "physical_compatibility_claimed": false
}
